source,chapter,page,tags,question,a,b,c,d ,answer,display
Measurement Appendix,17,3,Measurement,"Describe how recipes for ""home cooks"" might differ from recipes created for professional use:",They are more specific and highly technical,Measurements for ingredients are listed in imperial (US) measuring systems for home cooks but in metric measurements for professionals.,"Measurements account for professional equipment for professionals and are adjusted for ""home"" equipment for home cooks.",Measurements for ingredients are listed in volumes for home cooks and weights for professional use.,D,true 
Measurement Appendix,17,4,Measurement,Identify the measuring tool that is typically glass with a pouring spout.,Drying measuring cup,Liquid measuring cup,Measuring spoon,Tin cup,B,true 
Measurement Appendix,17,3,Measurement,Identify which answer shows the correct weight of one cup of cake flour.,10 ounces,5 ounces,2 ounces,7 ounces,B,true 
Measurement Appendix,17,4,Measurement,List the 3 sets of measuring tool you should keep on hand for accurately measuring while cooking.,"Dry cups, liquid cups, and dry spoons","Liquid spoons, dry cups, and dry spoons","Dry cups, a scale, and liquid cups","A scale, dry cups, dry spoons",A,true 
Measurement Appendix,17,3,Measurement,Identify what method professional cooks use to measure ingredients.,Volume,Weight,Feel,Looks,A,true 
Measurement Appendix,17,4,Measurement,Describe the best way to measure a solid.,dip the measuring cup and sweep off the excess,dip the measuring cup and shake off the excess,scoop with your hands,just pour as much as you feel is necessary,A,true 
Measurement Appendix,17,3,Measurement,Describe why professionals usually list ingredients by weight.,Weight offers no chance of error. 8 ounces = 8 ounces always,They do not like to use measuring cups,It depends where they are around the world,Weight it easier to read than amount of cups,A,true 
Measurement Appendix,17,2,Measurement,When did cooking instructions begin to include standardized units of measurement?,The 17th Century,The 18th Century,The 19th Century,The 20th Century,D,true 
Measurement Appendix,17,1,Measurement,"Who wrote ""The Boston Cooking-School Book"" in 1896?",Betty Crocker,Aunt Jemimah,Fannie Farmer,Julia Child,C,true 
Measurement Appendix,17,4,Measurement,Explain the differences between solids and gases.,"Solids are immobilized neurons and protons that are tight to each other in well definded structures, while gases are molecules that separate and move freely in the air.","Solids are immobilized atoms and molecules that are tight to each other in well-definded structures, while gases are molecules that separate and move freely in the air.","Solids are closely packed together molecules, while gases are molecules leaving a fixed structure","Solids are closely packed together molecules, while gases are molecules that remain in a fixed structure.",B,true 